[
  {
    "timestamp_utc": "2021-08-08T12:00:00Z",
    "asset": "XAU",
    "source_symbol": "XAU/USD",
    "market_type": "spot_aggregate",
    "source_provider": "example_only",
    "currency": "USD",
    "price_unit": "USD/kg",
    "open_usd_per_kg": null,
    "high_usd_per_kg": null,
    "low_usd_per_kg": null,
    "close_usd_per_kg": null,
    "quality_flags": "SCHEMA_EXAMPLE_NO_PRICE"
  }
]
